course_id,subject_area,course_title,avg_gpa,pct_A,pct_B,pct_C,pct_D,pct_F,dfw_rate,total_letter_grades,total_all_grades,total_dfw,total_A,total_B,total_C,total_D,total_F
HIST 187E,HIST,Variable Topics Historiography Proseminar: Latin America,3.653,79.41,14.71,1.47,1.47,2.94,4.29,68,70,3,54,10,1,1,2
HIST 187F,HIST,Variable Topics Historiography Proseminar: Near East,3.908,95.0,5.0,0.0,0.0,0.0,0.0,100,101,0,95,5,0,0,0
HIST 187G,HIST,Variable Topics Historiography Proseminar: East Asia,3.695,79.31,18.97,0.0,0.0,1.72,1.69,58,59,1,46,11,0,0,1
HIST 187I,HIST,Variable Topics Historiography Proseminar: Science/Technology,3.93,95.76,3.39,0.0,0.0,0.85,0.83,118,120,1,113,4,0,0,1
HIST 187J,HIST,Variable Topics Historiography Proseminar: Africa,3.532,68.33,25.0,3.33,1.67,1.67,4.69,60,64,3,41,15,2,1,1
HIST 187L,HIST,Variable Topics Historiography Proseminar: Jewish,3.929,97.14,2.86,0.0,0.0,0.0,0.0,35,41,0,34,1,0,0,0
HIST 189,HIST,Advanced Honors Seminars,3.882,97.06,0.0,0.0,0.0,2.94,2.94,34,34,1,33,0,0,0,1
HIST 191A,HIST,Capstone Seminar: History--Ancient History,3.478,56.86,35.29,7.84,0.0,0.0,1.89,51,53,1,29,18,4,0,0
HIST 191B,HIST,Capstone Seminar: History--Medieval,3.764,88.89,6.94,1.39,1.39,1.39,2.6,72,77,2,64,5,1,1,1
HIST 191C,HIST,Capstone Seminar: History--Europe,3.742,81.89,14.96,1.57,0.0,1.57,1.45,127,138,2,104,19,2,0,2
HIST 191E,HIST,Capstone Seminar: History--Latin America,3.841,91.46,6.1,1.22,1.22,0.0,1.12,82,89,1,75,5,1,1,0
HIST 191F,HIST,Capstone Seminar: History--Near East,3.737,87.63,9.28,0.0,0.0,3.09,2.97,97,101,3,85,9,0,0,3
HIST 191I,HIST,Capstone Seminar: History--Science/Technology,3.904,92.86,7.14,0.0,0.0,0.0,0.0,84,88,0,78,6,0,0,0
HIST 195,HIST,Community or Corporate Internships in History,3.932,95.74,4.26,0.0,0.0,0.0,0.0,47,48,0,45,2,0,0,0
HIST 195CE,HIST,Community and Corporate Internships in History,3.834,90.0,8.0,0.0,0.0,2.0,1.69,50,59,1,45,4,0,0,1
HIST 1A,HIST,"Introduction to Western Civilization: Ancient Civilizations, Prehistory to circa AD 843",3.365,60.0,28.93,6.25,1.79,3.04,5.04,560,615,31,336,162,35,10,17
HIST 1B,HIST,Introduction to Western Civilization: Circa 843 to circa 1715,3.573,71.13,24.25,2.76,0.57,1.3,2.65,1233,1359,36,877,299,34,7,16
HIST 1C,HIST,Introduction to Western Civilization: Circa 1715 to Present,3.695,80.89,14.86,2.6,0.51,1.14,1.64,1575,1649,27,1274,234,41,8,18
HIST 20,HIST,World History to AD 600,3.661,73.1,24.44,2.46,0.0,0.0,0.19,487,515,1,356,119,12,0,0
HIST 200L,HIST,Advanced Historiography: China,3.674,93.55,0.0,0.0,0.0,6.45,3.17,31,63,2,29,0,0,0,2
HIST 201I,HIST,Topics in History: Latin America,3.948,96.77,3.23,0.0,0.0,0.0,0.0,31,31,0,30,1,0,0,0
HIST 204A,HIST,"Departmental Seminar: Approaches, Methods, Debates, Practices",3.967,97.92,2.08,0.0,0.0,0.0,0.0,48,48,0,47,1,0,0,0
HIST 21,HIST,"World History, circa 600 to 1760",3.672,79.35,14.19,5.81,0.0,0.65,0.59,155,169,1,123,22,9,0,1
HIST 22,HIST,"Contemporary World History, 1760 to Present",3.475,61.82,33.33,1.82,0.0,3.03,2.7,165,185,5,102,55,3,0,5
HIST 2C,HIST,"Religion, Occult, and Science: Mystics, Heretics, and Witches in Western Tradition, 1000 to 1600",3.843,90.28,8.22,0.4,0.0,1.1,1.46,998,1094,16,901,82,4,0,11
HIST 3A,HIST,History of Science: Renaissance to 1800,3.767,85.44,11.55,1.74,0.63,0.63,1.23,632,653,8,540,73,11,4,4
HIST 3C,HIST,History of Science: 20th Century,3.559,70.54,22.77,4.02,0.0,2.68,2.5,224,240,6,158,51,9,0,6
HIST 3D,HIST,History of Modern Medicine,3.791,88.52,7.65,1.91,0.27,1.64,1.85,366,379,7,324,28,7,1,6
HIST 5,HIST,Holocaust: History and Memory,3.638,79.4,14.98,2.25,0.94,2.43,4.17,534,599,25,424,80,12,5,13
HIST 8A,HIST,Colonial Latin America,3.704,78.51,18.02,2.82,0.0,0.66,0.86,1526,1621,14,1198,275,43,0,10
HIST 8B,HIST,Modern Latin America,3.632,73.15,21.44,3.61,0.8,1.0,1.93,499,518,10,365,107,18,4,5
HIST 8C,HIST,Latin American Social History  ,3.632,77.21,15.68,4.83,0.4,1.88,2.35,746,765,18,576,117,36,3,14
HIST 94,HIST,What Is History? An Introduction to Historical Thinking and Practice,3.68,77.25,20.72,0.45,0.0,1.58,1.49,444,470,7,343,92,2,0,7
HIST 96W,HIST,Introduction to Historical Practice,3.64,78.63,15.57,2.58,0.56,2.65,3.24,1432,1451,47,1126,223,37,8,38
HIST 97C,HIST,Introduction to Historical Practice: Variable Topics in European History,3.79,84.43,13.17,1.8,0.0,0.6,1.16,167,173,2,141,22,3,0,1
HIST 97D,HIST,Introduction to Historical Practice: Variable Topics in U.S. History,3.74,80.0,20.0,0.0,0.0,0.0,0.0,35,38,0,28,7,0,0,0
HIST 97G,HIST,Introduction to Historical Practice: Variable Topics in East Asian History,3.732,93.55,0.0,0.0,0.0,6.45,5.41,31,37,2,29,0,0,0,2
HIST 9A,HIST,Introduction to Asian Civilizations: History of India  ,3.542,60.66,34.97,3.83,0.0,0.55,1.02,183,197,2,111,64,7,0,1
HIST 9C,HIST,Introduction to Asian Civilizations: History of Japan,3.902,93.9,5.16,0.47,0.0,0.47,0.46,213,219,1,200,11,1,0,1
HIST 9D,HIST,Introduction to Asian Civilizations: History of Middle East,3.791,86.31,10.91,1.98,0.0,0.79,0.73,504,547,4,435,55,10,0,4
HIST C187O,HIST,Topics in Historiography: World History,3.778,83.0,16.0,1.0,0.0,0.0,0.0,100,106,0,83,16,1,0,0
HIST C191D,HIST,Topics in History: U.S.,3.704,77.93,18.31,2.82,0.47,0.47,0.9,213,221,2,166,39,6,1,1
HIST C191F,HIST,Topics in History: Near East,3.988,100.0,0.0,0.0,0.0,0.0,0.0,49,51,0,49,0,0,0,0
HIST M103A,HIST,History of Ancient Egypt,3.244,44.44,42.22,8.89,2.22,2.22,4.35,45,46,2,20,19,4,1,1
HIST M103B,HIST,History of Ancient Egypt,3.755,85.0,12.5,0.0,2.5,0.0,2.5,40,40,1,34,5,0,1,0
HIST M10A,HIST,History of Africa to 1800,3.618,73.17,19.51,7.32,0.0,0.0,0.0,82,85,0,60,16,6,0,0
HIST M112C,HIST,History of Ancient Mediterranean World,3.746,76.92,23.08,0.0,0.0,0.0,0.0,39,43,0,30,9,0,0,0
HIST M112E,HIST,History and Monuments of Rome: Field Studies,3.867,97.44,2.56,0.0,0.0,0.0,0.0,39,39,0,38,1,0,0,0
HIST M133C,HIST,History of Prostitution,3.533,69.14,24.61,2.73,0.39,3.12,3.32,256,271,9,177,63,7,1,8
HIST M142C,HIST,History of Religion in U.S.,3.664,78.26,16.3,4.35,0.0,1.09,1.0,92,100,1,72,15,4,0,1
HIST M146B,HIST,American Working Class Movements,3.299,48.1,41.77,5.7,1.9,2.53,5.33,158,169,9,76,66,9,3,4
HIST M150B,HIST,Introduction to Afro-American History,3.872,91.6,7.25,0.76,0.0,0.38,0.37,262,271,1,240,19,2,0,1
HIST M150C,HIST,Introduction to Afro-American History,3.943,98.53,0.74,0.74,0.0,0.0,0.0,136,139,0,134,1,1,0,0
HIST M155,HIST,History of Los Angeles,3.524,78.79,15.15,0.0,0.0,6.06,5.88,33,34,2,26,5,0,0,2
HIST M182A,HIST,Ancient Jewish History,3.169,52.78,30.56,2.78,11.11,2.78,13.89,36,36,5,19,11,1,4,1
HIST M185F,HIST,History of Early Christians,3.633,77.78,16.05,2.47,2.47,1.23,3.53,81,85,3,63,13,2,2,1
HIST M186B,HIST,"Global Feminism, 1850 to Present",3.845,89.8,7.14,2.04,1.02,0.0,1.02,98,98,1,88,7,2,1,0
HIST M60W,HIST,Achaemenid Civilization and Empire of Alexander,3.566,73.61,19.44,5.56,0.0,1.39,2.03,144,148,3,106,28,8,0,2
HLT ADM 400,HLT ADM,Field Studies,3.649,76.09,20.29,2.9,0.0,0.72,0.68,138,146,1,105,28,4,0,1
HLT ADM 401,HLT ADM,Health Care Organization and Financing,3.852,91.34,6.14,1.44,0.0,1.08,1.08,277,277,3,253,17,4,0,3
HLT ADM 402,HLT ADM,Management and Organizational Behavior in Health Systems,3.749,85.45,11.27,1.41,0.0,1.88,1.83,213,218,4,182,24,3,0,4
HLT ADM 403,HLT ADM,Health-Care Information Systems and Technology,3.95,98.28,1.72,0.0,0.0,0.0,0.0,174,174,0,171,3,0,0,0
HLT ADM 404,HLT ADM,Health-Care Strategy,3.737,83.04,14.04,1.75,0.0,1.17,1.16,171,172,2,142,24,3,0,2
HLT ADM 405,HLT ADM,Leadership and Ethics,3.848,88.89,10.53,0.58,0.0,0.0,0.0,171,171,0,152,18,1,0,0
HLT ADM 406,HLT ADM,Health-Care Marketing,3.74,77.78,22.22,0.0,0.0,0.0,0.0,63,63,0,49,14,0,0,0
HLT ADM 407,HLT ADM,Digital Health Transformation,3.942,95.0,5.0,0.0,0.0,0.0,0.0,40,40,0,38,2,0,0,0
HLT ADM 408,HLT ADM,Human Resource Management in Health Care,3.877,90.82,8.16,1.02,0.0,0.0,0.0,98,98,0,89,8,1,0,0
HLT ADM 411,HLT ADM,Microeconomic Theory for Health Sector,3.378,56.63,33.73,7.23,0.0,2.41,2.41,83,83,2,47,28,6,0,2
HLT ADM 412,HLT ADM,Statistics for Health Management Decision-Making,3.77,79.8,18.23,0.99,0.0,0.99,0.91,203,220,2,162,37,2,0,2
HLT ADM 413,HLT ADM,Health-Care Operations Management,3.534,63.75,29.88,5.58,0.0,0.8,0.8,251,251,2,160,75,14,0,2
HLT ADM 414,HLT ADM,Health-Care Financial Accounting,3.618,68.42,30.41,0.0,0.0,1.17,1.14,171,175,2,117,52,0,0,2
HLT ADM 415,HLT ADM,Health-Care Financial Management,3.928,96.3,1.85,1.85,0.0,0.0,0.0,54,54,0,52,1,1,0,0
HLT ADM 416,HLT ADM,Quality Improvement and Performance Excellence,3.806,88.72,7.52,2.26,0.0,1.5,1.5,133,133,2,118,10,3,0,2
HLT ADM 417,HLT ADM,Data Analytics and Visualization,3.871,94.12,4.58,1.31,0.0,0.0,0.0,153,153,0,144,7,2,0,0
HLT ADM 418,HLT ADM,Health Reform: Policy and Implementation,3.934,92.96,7.04,0.0,0.0,0.0,0.0,71,71,0,66,5,0,0,0
HLT ADM 596,HLT ADM,Directed Individual Study or Research,3.956,98.82,1.18,0.0,0.0,0.0,0.0,254,268,0,251,3,0,0,0
HLT ADM 597,HLT ADM,Preparation for Master's Comprehensive Capstone Project,3.918,95.21,2.99,1.8,0.0,0.0,0.0,167,175,0,159,5,3,0,0
HLT POL 100,HLT POL,Health Care Systems and Health Policy,3.805,87.3,10.54,1.08,0.27,0.81,1.05,370,381,4,323,39,4,1,3
HLT POL 120,HLT POL,"Health Care Systems: Structures, Functions, and Policies",3.855,92.11,7.02,0.0,0.0,0.88,0.88,114,114,1,105,8,0,0,1
HLT POL 140,HLT POL,Foundations of Maternal and Child Health,3.895,92.18,7.82,0.0,0.0,0.0,0.0,409,411,0,377,32,0,0,0
HLT POL 141,HLT POL,Pharmaceuticals and Health,3.896,95.83,4.17,0.0,0.0,0.0,0.0,48,48,0,46,2,0,0,0
HLT POL 200A,HLT POL,Health Systems Organization and Financing,3.98,100.0,0.0,0.0,0.0,0.0,0.0,75,75,0,75,0,0,0,0
HLT POL 200B,HLT POL,Health Systems Organization and Financing,3.795,82.57,17.43,0.0,0.0,0.0,0.0,109,113,0,90,19,0,0,0
HLT POL 206,HLT POL,Healthcare for Vulnerable Populations,3.88,91.55,7.04,1.41,0.0,0.0,0.0,71,71,0,65,5,1,0,0
HLT POL 214,HLT POL,Measurement of Effectiveness and Outcomes of Health Care,3.929,92.11,7.89,0.0,0.0,0.0,0.0,38,38,0,35,3,0,0,0
HLT POL 215A,HLT POL,Healthcare Quality and Performance Management,3.929,93.33,6.67,0.0,0.0,0.0,0.0,75,75,0,70,5,0,0,0
HLT POL 215B,HLT POL,Applied Methods for Improvement/Implementation Science,4.0,100.0,0.0,0.0,0.0,0.0,0.0,64,65,0,64,0,0,0,0
HLT POL 225A,HLT POL,Health Services Research Design,3.992,100.0,0.0,0.0,0.0,0.0,0.0,78,78,0,78,0,0,0,0
HLT POL 225B,HLT POL,Health Services Research Design,3.713,85.53,13.16,0.0,0.0,1.32,1.22,76,82,1,65,10,0,0,1
HLT POL 225C,HLT POL,Research Methods for Improvement/Implementation Science,4.0,100.0,0.0,0.0,0.0,0.0,0.0,54,54,0,54,0,0,0,0
HLT POL 227A,HLT POL,Special Topics in Health Services: Seminar Series,4.0,100.0,0.0,0.0,0.0,0.0,0.0,33,36,0,33,0,0,0,0
HLT POL 232,HLT POL,Leadership Capstone Seminar,3.831,90.15,9.09,0.0,0.0,0.76,0.75,132,134,1,119,12,0,0,1
HLT POL 234,HLT POL,Health Services Organization and Management Theory,3.827,85.94,12.5,1.56,0.0,0.0,0.0,128,131,0,110,16,2,0,0
HLT POL 237C,HLT POL,Issues in Health Services Methodologies,3.682,74.36,25.64,0.0,0.0,0.0,0.0,39,42,0,29,10,0,0,0
HLT POL 240,HLT POL,"Global Health Institutions, Policies, and Systems",3.825,84.38,15.62,0.0,0.0,0.0,0.0,64,64,0,54,10,0,0,0
HLT POL 243,HLT POL,Population Health Approach to Autism Spectrum Disorder,4.0,100.0,0.0,0.0,0.0,0.0,0.0,55,57,0,55,0,0,0,0
HLT POL 244,HLT POL,Telehealth and Technology,3.992,100.0,0.0,0.0,0.0,0.0,0.0,76,79,0,76,0,0,0,0
HLT POL 286,HLT POL,American Political Institutions and Health Policy,3.986,100.0,0.0,0.0,0.0,0.0,0.0,84,86,0,84,0,0,0,0
HLT POL 289,HLT POL,Healthcare Disparities,3.739,74.19,22.58,3.23,0.0,0.0,0.0,31,33,0,23,7,1,0,0
HLT POL 400,HLT POL,Field Studies in Health Services,3.782,82.46,15.64,1.9,0.0,0.0,0.0,211,216,0,174,33,4,0,0
HLT POL 403,HLT POL,Healthcare Financial Accounting,3.708,76.19,22.22,1.06,0.0,0.53,0.51,189,197,1,144,42,2,0,1
HLT POL 423,HLT POL,Advanced Evaluation Theory and Methods for Health Services,3.885,90.0,10.0,0.0,0.0,0.0,0.0,40,40,0,36,4,0,0,0
HLT POL 430,HLT POL,Healthcare Innovation and E-Health,4.0,100.0,0.0,0.0,0.0,0.0,0.0,39,41,0,39,0,0,0,0
HLT POL 433,HLT POL,Health Care Strategy,3.824,89.15,8.53,2.33,0.0,0.0,0.0,129,130,0,115,11,3,0,0
HLT POL 436,HLT POL,Healthcare Financial Management,3.697,73.44,26.56,0.0,0.0,0.0,0.0,64,64,0,47,17,0,0,0
HLT POL 439,HLT POL,Data Software for Public Health Professionals,3.886,92.06,6.35,1.59,0.0,0.0,0.0,63,63,0,58,4,1,0,0
HLT POL 441,HLT POL,"Data Analytics: Identifying, Collecting, and Analyzing Data in Health Care",3.843,86.47,12.94,0.59,0.0,0.0,0.0,170,172,0,147,22,1,0,0
HLT POL 445,HLT POL,Healthcare Marketing,3.776,82.41,16.67,0.93,0.0,0.0,0.0,108,108,0,89,18,1,0,0
HLT POL 446,HLT POL,Health-Care Operations Management,3.914,98.25,0.0,0.0,0.0,1.75,1.72,57,58,1,56,0,0,0,1
HLT POL 596,HLT POL,Directed Individual Study or Research,3.96,97.53,2.47,0.0,0.0,0.0,0.0,81,81,0,79,2,0,0,0
HLT POL M110,HLT POL,"Ethnic, Cultural, and Gender Issues in America's Healthcare Systems",3.865,92.0,5.33,2.67,0.0,0.0,0.0,75,75,0,69,4,2,0,0
HLT POL M205,HLT POL,Pharmaceutical Policy,3.915,95.77,4.23,0.0,0.0,0.0,0.0,71,71,0,68,3,0,0,0
HLT POL M233,HLT POL,Health Policy Analysis,3.931,98.15,1.85,0.0,0.0,0.0,0.0,54,56,0,53,1,0,0,0
HLT POL M236,HLT POL,Microeconomic Theory of Health Sector,3.777,81.28,16.75,1.48,0.0,0.49,0.49,203,203,1,165,34,3,0,1
HLT POL M287,HLT POL,Politics of Health Policy,3.896,92.59,5.56,1.85,0.0,0.0,0.0,54,55,0,50,3,1,0,0
HLT POL M422,HLT POL,Practices of Evaluation in Health Services: Theory and Methodology,3.871,90.84,8.4,0.76,0.0,0.0,0.0,131,154,0,119,11,1,0,0
HLT POL M428,HLT POL,Child and Family Health Program Community Leadership Seminar,3.974,98.61,1.39,0.0,0.0,0.0,0.0,72,75,0,71,1,0,0,0
HLT POL M434,HLT POL,Building Advocacy Skills: Reproductive Health Focus,3.918,90.91,9.09,0.0,0.0,0.0,0.0,33,33,0,30,3,0,0,0
HLT POL M449A,HLT POL,"Child Health, Programs, and Policies",3.944,96.23,2.83,0.94,0.0,0.0,0.0,106,106,0,102,3,1,0,0
HNRS 105,HNRS,Racial and Ethnic Disparities in Healthcare,3.992,100.0,0.0,0.0,0.0,0.0,0.0,80,80,0,80,0,0,0,0
HNRS 109,HNRS,Living Consciously: Philosophy in Everyday Life,3.755,80.52,18.18,0.0,0.0,1.3,1.25,77,80,1,62,14,0,0,1
HNRS 112,HNRS,Poetry as Resistance: Remixing Archive,3.86,93.33,4.44,0.0,0.0,2.22,4.26,45,47,2,42,2,0,0,1
HNRS 119,HNRS,Hollywood and Cultural Diversity in America,3.946,98.65,0.0,0.0,0.0,1.35,1.32,148,152,2,146,0,0,0,2
HNRS 11W,HNRS,Postmodern Literature and Culture,3.809,86.05,11.63,2.33,0.0,0.0,0.0,43,43,0,37,5,1,0,0
HNRS 128,HNRS,Humor as Means of Social Control,3.847,92.31,5.13,0.0,1.28,1.28,2.53,78,79,2,72,4,0,1,1
HNRS 129,HNRS,Research in Psychology and Legacy of John Wooden,3.942,94.83,4.31,0.86,0.0,0.0,0.0,116,116,0,110,5,1,0,0
HNRS 132,HNRS,New Women and Activism from America to Asia,3.773,86.75,12.05,0.0,0.0,1.2,1.19,83,84,1,72,10,0,0,1
HNRS 136,HNRS,"Art, Entertainment, and Social Change",3.847,90.28,5.56,2.78,1.39,0.0,4.05,72,74,3,65,4,2,1,0
HNRS 138,HNRS,"Empire, Border Crossing, and Multiethnic Storytelling",3.887,98.15,1.85,0.0,0.0,0.0,0.0,54,54,0,53,1,0,0,0
HNRS 144,HNRS,International Development: Using Your Major for Doing Well and Doing Good,4.0,100.0,0.0,0.0,0.0,0.0,0.0,68,68,0,68,0,0,0,0
HNRS 146,HNRS,Imagining Global Climate Change,3.789,88.89,8.89,0.0,0.0,2.22,2.08,45,48,1,40,4,0,0,1
HNRS 149,HNRS,Art and Trauma,3.922,94.9,4.46,0.0,0.0,0.64,0.61,157,165,1,149,7,0,0,1
HNRS 153,HNRS,Comedy in Literature,3.671,79.41,20.59,0.0,0.0,0.0,0.0,34,34,0,27,7,0,0,0
HNRS 154,HNRS,Hollywood and Divided America,4.0,100.0,0.0,0.0,0.0,0.0,0.0,154,156,0,154,0,0,0,0
HNRS 159,HNRS,"Feminism, Art, and Metaphors of Trauma",3.928,94.5,5.5,0.0,0.0,0.0,0.0,109,109,0,103,6,0,0,0
HNRS 164,HNRS,Between Species: Human/Non-Human Animal Relationship,3.652,83.7,9.78,2.17,0.0,4.35,4.35,92,92,4,77,9,2,0,4
HNRS 177,HNRS,Biotechnology and Art,3.949,98.57,0.0,0.71,0.0,0.71,0.71,140,141,1,138,0,1,0,1
HNRS 43W,HNRS,"Science, Rhetoric, and Social Influence",3.854,91.23,8.77,0.0,0.0,0.0,0.0,57,59,0,52,5,0,0,0
HNRS 50,HNRS,Creating Your Roadmap,3.948,97.18,2.82,0.0,0.0,0.0,0.0,284,286,0,276,8,0,0,0
HNRS 65W,HNRS,Body-Mind Literacy,3.791,82.5,17.5,0.0,0.0,0.0,0.0,80,80,0,66,14,0,0,0
HNRS 70A,HNRS,"Genetic Engineering in Medicine, Agriculture, and Law",3.99,98.97,1.03,0.0,0.0,0.0,0.0,97,101,0,96,1,0,0,0
HNRS 78,HNRS,Science and Religion from Copernicus to Darwinism,3.919,97.22,2.78,0.0,0.0,0.0,0.0,108,113,0,105,3,0,0,0
HNRS 87W,HNRS,"Worlds of Neil Gaiman: Graphic Novels, Social Media, and Fantasy Fiction",3.769,82.22,15.56,0.0,0.0,2.22,2.0,45,50,1,37,7,0,0,1
HNRS M123XP,HNRS,Philanthropy as Civic Engagement,4.0,100.0,0.0,0.0,0.0,0.0,0.0,58,58,0,58,0,0,0,0
HNRS M143,HNRS,Latinx Immigration Policy and Politics,3.99,100.0,0.0,0.0,0.0,0.0,0.0,31,31,0,31,0,0,0,0
HNRS M145,HNRS,"Politics of Crisis: Migration, Identity, and Religion",3.811,91.67,2.78,5.56,0.0,0.0,0.0,36,36,0,33,1,2,0,0
HNRS M152,HNRS,Past People and Their Lessons for Our Own Future,3.979,97.87,2.13,0.0,0.0,0.0,0.0,47,47,0,46,1,0,0,0
HNRS M179,HNRS,Critical Vision: History of Art as Social and Political Commentary,3.997,100.0,0.0,0.0,0.0,0.0,0.0,118,118,0,118,0,0,0,0
HUM GEN 236A,HUM GEN,Advanced Human Genetics A: Molecular Aspects,3.897,95.45,4.55,0.0,0.0,0.0,0.0,198,198,0,189,9,0,0,0
HUM GEN 236B,HUM GEN,Advanced Human Genetics B: Genetics and Genomics Aspects,3.864,89.29,10.71,0.0,0.0,0.0,0.0,84,84,0,75,9,0,0,0
HUM GEN 400A,HUM GEN,Principles and Practices in Medical Genetics 1,3.808,78.33,21.67,0.0,0.0,0.0,0.0,60,60,0,47,13,0,0,0
HUM GEN 400B,HUM GEN,Principles and Practices in Medical Genetics 2,3.773,83.33,16.67,0.0,0.0,0.0,0.0,60,60,0,50,10,0,0,0
HUM GEN 400C,HUM GEN,Principles and Practices in Medical Genetics 3,3.89,95.0,5.0,0.0,0.0,0.0,0.0,60,60,0,57,3,0,0,0
HUM GEN 401,HUM GEN,Fundamental Genetic Counseling Skills,3.992,100.0,0.0,0.0,0.0,0.0,0.0,40,40,0,40,0,0,0,0
HUM GEN 402,HUM GEN,Reproductive Genetics in Practice,3.964,100.0,0.0,0.0,0.0,0.0,0.0,50,50,0,50,0,0,0,0
HUM GEN 403,HUM GEN,Specialty Genetics in Practice,3.699,80.0,20.0,0.0,0.0,0.0,0.0,80,80,0,64,16,0,0,0
HUM GEN 404,HUM GEN,Advanced Genetic Counseling Skills,3.992,100.0,0.0,0.0,0.0,0.0,0.0,40,40,0,40,0,0,0,0
HUM GEN 405,HUM GEN,Professional Development in Genetic Counseling,3.902,92.5,7.5,0.0,0.0,0.0,0.0,40,40,0,37,3,0,0,0
HUM GEN 406,HUM GEN,Foundations of Genomic Medicine,3.96,97.5,2.5,0.0,0.0,0.0,0.0,40,40,0,39,1,0,0,0
HUM GEN 410,HUM GEN,Translational Genomics,3.892,90.0,10.0,0.0,0.0,0.0,0.0,40,40,0,36,4,0,0,0
HUM GEN 411,HUM GEN,Foundations in Genetic Counseling Research,3.755,80.0,20.0,0.0,0.0,0.0,0.0,60,60,0,48,12,0,0,0
HUM GEN 412,HUM GEN,Research Applications in Genetic Counseling,3.795,82.5,17.5,0.0,0.0,0.0,0.0,40,40,0,33,7,0,0,0
HUM GEN 430,HUM GEN,Clinical Applications of Cytogenetics and Molecular Techniques,3.715,75.0,25.0,0.0,0.0,0.0,0.0,60,60,0,45,15,0,0,0
HUM GEN C413,HUM GEN,"Ethical, Legal, and Societal Topics in Genetic Counseling",3.962,100.0,0.0,0.0,0.0,0.0,0.0,40,40,0,40,0,0,0,0
I A STD 1,I A STD,Introduction to International and Area Studies,3.527,65.55,26.33,5.88,1.4,0.84,2.13,357,376,8,234,94,21,5,3
I A STD 160,I A STD,Selected Topics in International and Area Studies,3.607,67.65,27.94,2.94,0.0,1.47,1.41,68,71,1,46,19,2,0,1
I A STD 188,I A STD,Special Courses in International and Area Studies,3.657,79.59,14.29,4.08,0.0,2.04,2.04,49,49,1,39,7,2,0,1
I A STD 191,I A STD,Variable Topics Senior Research Seminars: International and Area Studies,3.632,80.0,12.38,5.71,0.95,0.95,1.87,105,107,2,84,13,6,1,1
I A STD 195CE,I A STD,Community and Corporate Internships in International and Area Studies,3.892,95.15,2.91,0.0,1.94,0.0,2.65,103,113,3,98,3,0,2,0
I A STD 33,I A STD,Introduction to East Asia,3.565,65.97,31.93,1.68,0.0,0.42,0.4,238,250,1,157,76,4,0,1
I A STD 50,I A STD,Introduction to Latin America,3.56,65.57,27.32,6.01,0.55,0.55,1.55,183,194,3,120,50,11,1,1
I E STD M20,I E STD,Visible Language: Study of Writing,3.854,88.78,11.22,0.0,0.0,0.0,0.91,98,110,1,87,11,0,0,0
I E STD M70,I E STD,Language and Evolution,3.926,95.95,2.7,1.35,0.0,0.0,0.0,74,77,0,71,2,1,0,0
I M STD 155,I M STD,"Theory, Research, and Methods in Study of International Migration",3.714,79.31,13.79,6.9,0.0,0.0,0.0,58,58,0,46,8,4,0,0
INDO 1,INDO,Introductory Indonesian,3.947,96.36,3.64,0.0,0.0,0.0,0.0,55,59,0,53,2,0,0,0
INDO 2,INDO,Introductory Indonesian,3.928,94.44,5.56,0.0,0.0,0.0,0.0,36,37,0,34,2,0,0,0
INDO 3,INDO,Introductory Indonesian,3.84,85.0,12.5,2.5,0.0,0.0,0.0,40,44,0,34,5,1,0,0
INF STD 10,INF STD,Information and Power,3.848,92.33,6.33,0.67,0.0,0.67,0.66,300,301,2,277,19,2,0,2
INF STD 180,INF STD,Special Topics in Information Studies,3.625,74.29,20.0,4.76,0.95,0.0,0.86,105,116,1,78,21,5,1,0
INF STD 20,INF STD,Digital Cultures and Societies,3.625,75.29,20.39,2.35,1.18,0.78,1.95,255,256,5,192,52,6,3,2
INF STD 202,INF STD,History of Books and Literacy Technologies,3.817,90.79,6.58,0.0,0.0,2.63,2.44,76,82,2,69,5,0,0,2
INF STD 211,INF STD,Artifacts and Cultures,3.954,97.01,2.99,0.0,0.0,0.0,0.0,301,306,0,292,9,0,0,0
INF STD 212,INF STD,Values and Communities in Information Professions,3.969,99.02,0.49,0.49,0.0,0.0,0.0,205,208,0,203,1,1,0,0
INF STD 213,INF STD,Current Issues in Librarianship,4.0,100.0,0.0,0.0,0.0,0.0,0.0,32,34,0,32,0,0,0,0
INF STD 241,INF STD,Digital Preservation,3.971,100.0,0.0,0.0,0.0,0.0,0.0,82,85,0,82,0,0,0,0
INF STD 260,INF STD,Description and Access,3.879,94.43,4.53,0.35,0.0,0.7,0.68,287,295,2,271,13,1,0,2
INF STD 270,INF STD,Systems and Infrastructures,3.92,95.25,4.07,0.34,0.0,0.34,0.33,295,304,1,281,12,1,0,1
INF STD 272,INF STD,Human/Computer Interaction,3.978,97.78,2.22,0.0,0.0,0.0,0.0,45,45,0,44,1,0,0,0
INF STD 279,INF STD,User Experience Design,3.995,100.0,0.0,0.0,0.0,0.0,0.0,60,60,0,60,0,0,0,0
INF STD 280,INF STD,Social Science Research Methodology for Information Studies,3.915,97.87,2.13,0.0,0.0,0.0,0.0,47,49,0,46,1,0,0,0
INF STD 289,INF STD,Seminar: Special Issues in Information Studies,3.872,94.86,3.81,0.38,0.0,0.95,0.87,525,573,5,498,20,2,0,5
INF STD 298B,INF STD,Special Topics in Methodology of Information Studies,3.953,95.35,4.65,0.0,0.0,0.0,0.0,43,51,0,41,2,0,0,0
INF STD 30,INF STD,Internet and Society,3.615,61.97,37.61,0.0,0.0,0.43,0.43,234,234,1,145,88,0,0,1
INF STD 422,INF STD,"College, University, and Research Libraries",4.0,100.0,0.0,0.0,0.0,0.0,0.0,48,48,0,48,0,0,0,0
INF STD 423,INF STD,Public Libraries  ,3.991,100.0,0.0,0.0,0.0,0.0,0.0,68,78,0,68,0,0,0,0
INF STD 431,INF STD,"Archives, Records, and Memory",3.864,93.36,6.64,0.0,0.0,0.0,0.0,211,234,0,197,14,0,0,0
INF STD 432,INF STD,Issues and Problems in Preservation of Heritage Materials,3.768,78.87,21.13,0.0,0.0,0.0,0.0,71,71,0,56,15,0,0,0
INF STD 433,INF STD,Community-Based Archiving,3.959,99.13,0.0,0.87,0.0,0.0,0.0,115,122,0,114,0,1,0,0
INF STD 434,INF STD,Archival Use and Users,3.854,91.67,6.25,0.0,0.0,2.08,1.64,48,61,1,44,3,0,0,1
INF STD 438A,INF STD,Seminar: Advanced Issues in Archival Science--Archival Appraisal,3.876,97.62,0.0,0.0,0.0,2.38,1.96,42,51,1,41,0,0,0,1
INF STD 438B,INF STD,Seminar: Advanced Issues in Archival Science--Archival Description and Access Systems,3.968,98.98,1.02,0.0,0.0,0.0,0.0,98,107,0,97,1,0,0,0
INF STD 439,INF STD,Seminar: Special Collections,3.968,97.37,2.63,0.0,0.0,0.0,0.0,114,114,0,111,3,0,0,0
INF STD 461,INF STD,Descriptive Cataloging  ,3.903,95.16,4.84,0.0,0.0,0.0,0.0,62,71,0,59,3,0,0,0
INF STD 462,INF STD,Subject Cataloging and Classification,3.868,89.83,10.17,0.0,0.0,0.0,0.0,59,68,0,53,6,0,0,0
INF STD 464,INF STD,Metadata,3.94,95.38,4.62,0.0,0.0,0.0,0.0,65,94,0,62,3,0,0,0
INF STD 480,INF STD,Introduction to Media Archiving and Preservation,3.857,91.3,8.7,0.0,0.0,0.0,0.0,69,71,0,63,6,0,0,0
INF STD C115,INF STD,Introduction to Information Literacies,3.918,96.97,1.52,1.52,0.0,0.0,0.0,66,69,0,64,1,1,0,0
INF STD M244,INF STD,"Collection Management for Archives, Libraries, and Museums",3.724,78.79,21.21,0.0,0.0,0.0,0.0,33,34,0,26,7,0,0,0
INTL DV 1,INTL DV,Introduction to International Development Studies,3.865,93.63,4.66,0.63,0.27,0.81,1.06,1115,1136,12,1044,52,7,3,9
INTL DV 110,INTL DV,"Culture, Power, and Development",3.685,78.17,17.69,3.06,0.44,0.66,1.07,458,466,5,358,81,14,2,3
INTL DV 130,INTL DV,Theory and History in International Development,3.449,57.6,36.03,4.9,0.25,1.23,1.46,408,411,6,235,147,20,1,5
INTL DV 140,INTL DV,Decolonizing Political Economy: Colonialism and Development,3.852,88.21,11.79,0.0,0.0,0.0,0.0,229,231,0,202,27,0,0,0
INTL DV 160,INTL DV,Selected Topics in International Development Studies,3.373,52.68,34.82,10.71,1.79,0.0,1.71,112,117,2,59,39,12,2,0
INTL DV 191,INTL DV,Variable Topics Research Seminars: International Development Studies--Senior Seminar,3.73,84.45,11.66,2.47,0.0,1.41,1.38,283,290,4,239,33,7,0,4
INTL DV M120,INTL DV,Political Economy of Development,3.513,64.71,25.49,9.15,0.33,0.33,0.65,306,307,2,198,78,28,1,1
INTL DV M150,INTL DV,Political Economy of Climate Change,3.488,64.74,25.43,5.78,2.89,1.16,3.98,173,176,7,112,44,10,5,2
IRANIAN 102A,IRANIAN,Intermediate Persian  ,3.935,97.67,2.33,0.0,0.0,0.0,0.0,43,53,0,42,1,0,0,0
IRANIAN 102B,IRANIAN,Intermediate Persian  ,3.951,97.78,2.22,0.0,0.0,0.0,0.0,45,51,0,44,1,0,0,0
IRANIAN 102C,IRANIAN,Intermediate Persian  ,3.946,97.14,2.86,0.0,0.0,0.0,0.0,35,41,0,34,1,0,0,0
IRANIAN 164,IRANIAN,Ancient Cities of Iran: Archaeological Survey of Historic Cities and Sites of Iran from 4000 BC to 1900 AD,3.94,95.0,4.38,0.62,0.0,0.0,0.0,160,161,0,152,7,1,0,0
IRANIAN 187,IRANIAN,Variable Topics in Iranian Studies,3.967,98.26,1.74,0.0,0.0,0.0,0.0,115,118,0,113,2,0,0,0
IRANIAN 1A,IRANIAN,Elementary Persian  ,3.948,96.77,3.23,0.0,0.0,0.0,0.0,62,80,0,60,2,0,0,0
IRANIAN 1B,IRANIAN,Elementary Persian,3.81,90.0,8.33,0.0,0.0,1.67,1.28,60,78,1,54,5,0,0,1
IRANIAN 1C,IRANIAN,Elementary Persian  ,3.856,88.89,11.11,0.0,0.0,0.0,0.0,36,50,0,32,4,0,0,0
IRANIAN 20A,IRANIAN,Accelerated Elementary Persian,3.888,94.87,3.85,0.0,1.28,0.0,1.2,78,83,1,74,3,0,1,0
IRANIAN 20B,IRANIAN,Accelerated Elementary Persian,3.938,95.59,4.41,0.0,0.0,0.0,0.0,68,73,0,65,3,0,0,0
